keyword,region,id,user,text,created_at,source
大学,广东,5096393970816762,寻梦自然,#腹式呼吸为什么能缓解焦虑##真的建议大家多做腹式呼吸# 美国运动科学院院士、美国伊利诺伊大学终身教授朱为模称，腹式呼吸是一个强大的抗病“工具箱”，可以将身体带回神经系统的平静部分，即副交感神经系统（控制消化、休息，并可帮助减缓呼吸和心率），关闭负责“战斗或逃跑”的交感神经反应；有助降低皮质醇水平、降血压、缓解焦虑；改善自主神经对压力的反应，改善动脉血流量、睡眠质量等。,2024-11-02 22:41,HUAWEI Mate 40 Pro
大学,广东,5096393952461646,captain09_,每次弹着吉他合唱的时候都觉得自己真的活着真的有情绪 上次音乐节也是 真的整整一年了 和不同的人坐在不同的地方 才意识到一切真的过去了 我们都要向前看 此刻真的幸福 我在大学遇到的所有好朋友总在某些时刻带着我向前走了几步,2024-11-02 22:41,iPhone客户端
大学,广东,5096393935686349,咖哩恰拉,昆明理工大学超话 考研报了不网上确认会退费吗,2024-11-02 22:41,昆明理工大学超话
大学,广东,5096393926515191,没时间玩的shy,要是大学的时候认识229的话 我们是肯定不会成为朋友的,2024-11-02 22:41,iPhone 13 mini
大学,广东,5096393916286349,燃藜火,谢可寅参加我就是演员3的时候还是the 9在团时期。作为爱豆参加表演竞技综艺，因为有往期节目中n多尴尬的表演先例，接下来的冷嘲热讽似乎是可以预期的。但是我没有担心，虽然当时的经纪人和身边的工作人员都有担心。不仅仅因为知道她大学专业是戏剧表演，更是因为我看过一些她的搞怪视频，知道她经常戏精上身，比如录制节目的时候，她不小心进入导师室，为了不引起导师注意，她会乔装成工作人员，无实物表演拿着针线（实际没有针线）缝补演出服，最后再用嘴咬断线头，抚平修补部分的褶皱，惟妙惟肖，让你以为她手里真的有针和线，而这种热情和天赋会去寻找她释放的通道，通过戏剧表演的形式流溢出来。推荐她参加我就是演员3的是那时候与她素不相识的蒋欣老师。蒋欣看了青春有你2，她在节目的衍生小剧场里发现了谢可寅的表演才华，把她推荐给了我就是演员3的导演。果真，谢可寅因为在我就是演员3的出色表现，演技得到了当时所有导师的表扬和认可，走到最后拿到了“潜力之星”奖，打了那些提前对她冷嘲热讽的人的脸（这里不含因为善意关心而担心的人，也不含因为她的表现而对她有改观的人，以及其他含有善意的人）。因为在这个节目上认识了伊能静老师，伊能静把她推荐给了《亲爱的小孩》剧组。从当时的各种记录资料来看，剧组里从导演到演员老师创作氛围都很好。也有极少部分人质疑过，她一个偶像团体的成员，能演好这个角色吗？但是后来播出后，谢可寅收获了观众对于董帆这个角色的认可、对她演技的认可，至今还有人记得帆帆。去年，中国说唱巅峰对决嘉宾官宣初期，她又遇到了说唱听众的质疑，和演技综艺一样，仍然是对她爱豆身份的质疑：你一个爱豆参加新说唱，你有自己的作品吗？而说唱综艺和演技综艺一样，爱豆受到冷嘲热讽似乎也是可以预期的。但是我也没有担心，因为我知道她能写出《奇怪的人唱奇怪的歌》、《翅膀》、《不服》等等几首从自身经验、体验和情感出发/初步勾勒出了她音乐人格的歌，作为说唱节目的观众，觉着这种类型的歌词还是有受众的。果真，她再一次打了那些提前嘲笑她的人的脸（这里不含因为善意关心而担心的人，也不含因为她的表现而对她有改观的人，以及其他含有善意的人），她不仅是被节目观众认证为第一个参加说唱综艺而没有被群嘲的爱豆，而且合作曲《流浪·地球》（再次说明：她唱的部分是她写的/是她写的/是她写的）是去年这个节目的hit songs之一，个人单曲《叫姐姐》节目官抖点赞量top.《雪迷宫》进组初期直到播出前期也陆续有过对她爱豆身份参演的质疑，而等到今年9月《雪迷宫》播出直到现在，陆续看到观众说（总结大意）：一开始也很疑惑，为什么要让一个爱豆加入，但是看到谢可寅在剧中的表现就明白了。她成功地塑造了一个女刑警，有生活的质感，“周正”，“眼神清亮”。而我唯一的担心的确是因为《珠帘玉幕》，担心古偶里面白花花的滤镜会把她脸部的自然状态消磨成一个毫无瑕疵但是塑料感十足的平滑壳，因此而让表演质感打了折扣。幸好，剧方在正片里没有用原先预告片里的滤镜，崔十九很好地保持了她的个人特色和脸部的真实质感。原本打算不管怎样都闭嘴的，但是看到剧里的崔十九后，非常喜欢她的台词和表演状态，竟然发了好几条微博，尤其这条这么长的。#珠帘玉幕##谢可寅崔十九# ,2024-11-02 22:40,微博网页版
大学,广东,5096393885095785,用户5206982362,"6066---小头像大学问6067---冲哥_帐号诊断_直播运营_-【只需三步_直播间流量破层级实操_默认班级】-199800圆-29节6068---PS设计实战原理技能实战全套（零基础到高级）_ps平面设计（ai,cdr）",2024-11-02 22:40,微博网页版
大学,广东,5096393872245514,GEYUSHA-,我最最最最爱的女孩结婚了～我们是大学相识相知，成为了知己、形影不离的朋友、离不开的家人～陪伴了对方的春秋冬夏，人生漫漫长路，从认识到现在，我们都在参与对方的生活！我们无话不谈，分享所有～我有多爱她可能只有我自己知道吧！她陪了我太多太多，了解我太深太深。同样的，我对她也是～我经常说，我可以不用那么幸福，但我希望她能超级无敌幸福！她像我想成为，却成为不了的另一个我 ，她温柔善良、积极乐观、开朗活泼！她结婚我没能去，因为我不想让她的婚礼有一丝一毫的不圆满、正因为没能去，所以才是我对她送的最圆满真挚的祝福～我希望她未来的日子里，能够幸福美满、开心快乐！依然如我们刚认识的时候那般纯真无邪～希望她收获所有的幸福快乐，希望她收获到了最完美的爱情！驴啊～我最爱的朋友，新婚快乐，永远幸福！,2024-11-02 22:40,iPhone客户端
大学,广东,5096393868318398,风萧萧兮知寒,最想上大学的时候。没人告诉我上大学是做不完的实验写不完的实验报告 算不完的高数小题,2024-11-02 22:40,iPhone 15 Pro
大学,广东,5096394166111263,用Magic打败Science,什么地狱笑话//@Agent20003:啊啊啊啊啊啊啊//@落日映红绳_:因为人家是中专 大学哪有这么管用的,2024-11-02 22:41,带刺的玫瑰Android
大学,广东,5096394149597138,衷爱喵星人,既学霸应该如何如何后，大学生第一次上大学应该如何如何又出现了……不是，你们这些人是做过什么科学统计，还是有什么权威报告给全世界的学霸和学生报道状态做出一个明确解释了？全是自己的想象，半点依据都没，全世界的学霸和大学生的状态就这样被一群估计连大学都没上过的人给代表了！他不配演学霸，那这群人就配定义学霸了？咋大学生第一次远离父母上大学的状态，非要照着你们的想象才配得上大学生的身份？,2024-11-02 22:41,微博网页版
大学,广东,5096394141206669,CTernuraKilig,被有正向反馈的总监会哈佛大学教授的讲座和合唱团充实的加班周六我很快乐[成人礼],2024-11-02 22:41,微博轻享版
大学,广东,5096394127317249,Artemislet,头发 我求你别掉了千万别还没上大学头发先没了,2024-11-02 22:41,iPhone
大学,广东,5096394100835281,-今天也没睡醒啊,看到pyq的学妹上大学感觉好幸福啊,2024-11-02 22:41,iPhone 14 Pro
大学,广东,5096394074097721,宁馨儿今天退休了嘛,我喆声音和大学老师的角色也好适配高贵却不失温柔    听的人心里美美滴,2024-11-02 22:41,iPhone客户端
大学,广东,5096394058631501,倾水揽星河,在这度过一年多的早7晚10是大学时最充实的时光怀念啊我的青春啊,2024-11-02 22:41,HUAWEI P60 Pro
大学,广东,5096394044479880,栗栗mm1,今天有件喜事 成功预约国博这是我第三次去北京了 上一次还是大学很开心,2024-11-02 22:41,iPhone客户端
大学,广东,5096394044735786,心动宁波,【学习身边的榜样——余姚市二职校教师 郑晓红 #坚守初心德技双馨# 】郑晓红老师出生于四明山的一个小山村中村，那里山清水秀，民风淳朴。她自小便对大自然充满了热爱，对农业有着浓厚的兴趣。大学毕业后，她毅然放弃了城市里的工作机会，选择回到老区，投身于农业教育事业。她深知，农业是国家的根本，而教育则是推动农业发展的不竭动力。因此，她立志通过自己的努力，为家乡的农业发展培养更多的人才。教育是一项神圣的事业，需要用心去经营、用爱去浇灌。21年来，郑晓红老师始终坚守在教育的第一线，她不仅负责国家级赛事的相关工作，还担任了15年的班主任，用自己的实际行动去感染和影响学生，让他们在成长的道路上少走弯路，过上有尊严的生活，收获更出彩的人生。 2宁波,2024-11-02 22:41,
大学,广东,5096394035043407,从前有一只废话,每一次线下和同担老公们见面的时候都会想起大学毕业那几个月的疯狂线下时刻🥺人怎么可以这么幸福,2024-11-02 22:41,
大学,广东,5096394031896052,她惊艳我,苏州大学研究生超话,2024-11-02 22:41,苏州大学研究生超话
大学,广东,5096394027172571,megu蘑菇,八分钟速扎明天背去上早八报了辅修是我大学四年最失败的决定g77脑袋好硬使我的垃圾痛板摇摇欲坠,2024-11-02 22:41,HUAWEI P40 5G
大学,广东,5096394018263662,荒烟蔓草的从前,#终身学习有多重要#  @高顿 终身学习的重要性不言而喻，在我身边，姑姑就是一个终身学习的杰出榜样。姑姑自幼对语文情有独钟，上学时就凭借出色的文笔频繁投稿并登上优秀作文榜。大学选择了汉语言文学专业，毕业后顺利考进教师编制，从事语文教学工作。然而，她并未就此满足，即便成为了老师，依然在学习的道路上不断前行。除了深耕语文知识，还钻研历史知识，在家中时常为我们讲述精彩的历史故事。如今，姑姑已年届五十，但学习的热情从未减退。只要有时间，她就会沉浸在书的世界里，从不懈怠。她常说，看书是一种享受，将知识传授给他人更是一种幸福。姑姑用自己的行动诠释了终身学习的意义。她不仅不断充实和提升自己，更通过持续学习保持着对生活的热爱和对知识的敬畏。在她身上，我看到了终身学习带来的丰富内涵和无尽价值，它让人始终保持敏锐的思维，不断拓展视野，适应时代的变化，也让人的精神世界愈发充实和满足。我会一直以姑姑为榜样，拥抱终身学习，追求更有意义和价值的人生。,2024-11-02 22:41,iPhone 15
大学,广东,5096394006988043,她惊艳我,苏州大学考研超话,2024-11-02 22:41,苏州大学考研超话
大学,广东,5096393970816762,寻梦自然,#腹式呼吸为什么能缓解焦虑##真的建议大家多做腹式呼吸# 美国运动科学院院士、美国伊利诺伊大学终身教授朱为模称，腹式呼吸是一个强大的抗病“工具箱”，可以将身体带回神经系统的平静部分，即副交感神经系统（控制消化、休息，并可帮助减缓呼吸和心率），关闭负责“战斗或逃跑”的交感神经反应；有助降低皮质醇水平、降血压、缓解焦虑；改善自主神经对压力的反应，改善动脉血流量、睡眠质量等。,2024-11-02 22:41,HUAWEI Mate 40 Pro
大学,广东,5096393952461646,captain09_,每次弹着吉他合唱的时候都觉得自己真的活着真的有情绪 上次音乐节也是 真的整整一年了 和不同的人坐在不同的地方 才意识到一切真的过去了 我们都要向前看 此刻真的幸福 我在大学遇到的所有好朋友总在某些时刻带着我向前走了几步,2024-11-02 22:41,iPhone客户端
大学,广东,5096393935686349,咖哩恰拉,昆明理工大学超话 考研报了不网上确认会退费吗,2024-11-02 22:41,昆明理工大学超话
大学,广东,5096393926515191,没时间玩的shy,要是大学的时候认识229的话 我们是肯定不会成为朋友的,2024-11-02 22:41,iPhone 13 mini
大学,广东,5096393607218190,西瓜卡比,感觉回到大学的时候,2024-11-02 22:39,iPhone客户端
大学,广东,5096393591493142,深圳Jacky,提问：任总您好，我来自清华大学。之前听您说在创业时受到一些生活压力的影响。在过程中，可能也有很多奇妙的宇宙能量将您引领到不同的地方。华为作为一个整体，受到了一些来自现实世界中的限制。我特别好奇的是，请任总设想下，在理想化的世界中，您可以自由地做自己想做的任何事情，您最想做的事情是什么，或者说您理想的生活状态是怎样的，在什么样的状态下您是最幸福的？任正非：我很羡慕你，没经受过饥饿，不知道饥饿为何物。我们年轻的时候是经受过饥饿的，那个时代人生的梦想是吃一个馒头。对于你们来说，现在晚餐想要吃一个馒头都能吃到，我们那个年代没有。我创业的那个时代也正是整个时代的转换点，中国从计划经济转到市场经济，我们从军队转业成为地方老百姓，我们什么都搞不明白，怎么去赚钱呢？打工都不行，打工也是市场经济的。我们以为市场经济有的是机会。我创业，不是像大家想象的那样有什么理想，就是为了活下来，为了有饭吃。我们那个时候，是生活所迫，无怨无悔，没有退路，只有往前走，还不能谈梦想。到今天，也还不能说我们就能活下来。中国99%的公司是可以与美国合作，他们没有受到制裁，他们的芯片算力比我们的高，他们能买到的东西比我们好。在这样的条件下，未来几年我们能不能为生存活下去？不要看我们今天和大家欢聚一堂，以为我们有伟大的梦想，不是，我们还在挣扎中。我们内部讲话与跟你们的聊天，完全不是一个量级，我们内部讲话还在讲怎么克服很多困难。我很崇拜你们。为什么呢？你想想，我们年轻时做梦都不会想到进清华，我哪敢做清华梦啊。我们那个山沟沟里，能读个大学就很伟大了，还想读清华、读北大？根本没有这个可能。你们有这么好的条件，将来担负起创造人类新命运的使命来，你们有巨大的机会窗。你们要履行社会责任。将来你们不是社会领袖、政府领袖，可能就是企业领袖，一定要爱这个社会，一定要给社会贡献力量，美好的社会是共同来创造，不能把钱装在自己口袋里就高兴了。我羡慕你们年轻人，读这么好的学校。—— 任正非与ICPC主席、教练及获奖选手座谈会上的发言，2024年10月14日。注：ICPC，国际大学生程序设计竞赛（International Collegiate Programming Contest，简称“ICPC”）。,2024-11-02 22:39,iPhone 14 Pro Max
大学,广东,5096393557939679,小氺龟,发布了头条文章：《西安行记——古都新影与文化碰撞》]西安旅行超话 #一个人的旅行# #西安旅行攻略# #大学老师# @作家叶倾城  O西安行记——古都新影与文化碰撞,2024-11-02 22:39,微博 weibo.com
大学,广东,5096393545620402,欢乐使者律师,由天津大学常州大学等主办，兴学强国与发展新质生产力暨盛宣怀诞辰一百八十周年学术研讨会，下午成功举办。天大书记、宣传部长致辞，人文艺术学院吕静书记主持，大学文化与校史所张世轶所长组织讨论。知名校史专家王杰教授等就北洋教育、张謇比较、文史名城建设发言。我结合专业投稿一篇《盛宣怀兴建北洋法科教育对中国政治生产力的深远影响》荣幸收入论文集。晚上一起欣赏名导演十天排就讲盛公韬略伟绩的舞台剧，颇受教育和感动。 2常州·武进区常州科教城创研港2号楼楼,2024-11-02 22:39,微博轻享版
大学,广东,5096393522025136,zwxzzwxx,天啊既然要有第二季了我当时真的被郑贤彬帅晕了#大学战争2# #大学战争#,2024-11-02 22:39,iPhone客户端
大学,广东,5096393509437708,慢慢_1234567,太久没见韩子，一见面感觉一下子又回到大学时候哈哈哈哈哈哈哈哈哈哈，聊起近况发现都是ddl赶工人，笑晕的….ddl是生产力！下次还要一起玩，还要坐副驾，还想搓麻将..！韩子下次要给我带麦、在好朋友的车上k歌真的好爽……,2024-11-02 22:39,iPhone客户端
大学,广东,5096393489778762,恰口小茄包,聊城大学超话 问问大四体测。。。有谁跑完了可以告诉我都有什么流程吗呜呜呜呜呜呜呜,2024-11-02 22:39,聊城大学超话
大学,广东,5096393456222804,而爱是永不止息,大学生活乏味至此也是一种本领对吧？,2024-11-02 22:39,iPhone客户端
大学,广东,5096393809331778,小1要走上坡路,司南教育学考研打卡第67天@教育学谢康康明天花一点时间把专二最后一点结尾了。本来打算今天晚上再鼓鼓劲一口气背完，，但是好像有点难…内容有点多…#司南教育学考研##湖南师范大学#,2024-11-02 22:40,iPhone客户端
大学,广东,5096393808812580,美国创业者,斯坦福大学公开课《跑步损伤：预防与治疗》,2024-11-02 22:40,iPhone 12
大学,广东,5096393733578220,MEIYOU艾辰,云南大学#随手拍# 2昆明·云南大学(呈贡校区),2024-11-02 22:40,Xiaomi 14
大学,广东,5096393725974595,小鹿靓仔,陪老婆回她的母校，感觉整个人都年轻了不少逛逛吃吃的大半天，真的舒服，现在这大学学生太幸福了吧，这饭堂、这周边的美食街，真的对吃货太友好了，羡慕,2024-11-02 22:40,OnePlus 7 Pro
大学,广东,5096393707882685,我都有并了你就让让我吧,跟zjd狠狠吐槽了两小时大学室友，感觉像躺着宿舍里爽爽的（）分别的时候一句不想上班一下子我就从一个青春女大变回了疲惫牛马,2024-11-02 22:40,HUAWEI Mate 30 5G
大学,广东,5096393703952402,复旦大学,发布了头条文章：《大学似海，深水静流！一场复旦新闻人的对谈~》  O大学似海，深水静流！一场复旦新闻人的对谈~,2024-11-02 22:40,微博 weibo.com
大学,广东,5096393687965392,CccYYa丶,20尾场的遗憾就用lpl大学战队线下观赛弥补吧,2024-11-02 22:40,CYの🍓iPhone 16 Pro Max
大学,广东,5096393683769577,北京工商大学,北京工商大学超话#晚安工商#当大雾悄然散去，阳光终将洒满大地。就如同在人生中，无论经历多少迷茫与困惑，我们都要相信，光明总会如期而至。晚安，北工商。（摄影：陶钰涵）,2024-11-02 22:40,北京工商大学超话
大学,广东,5096393671444102,杭州网,#重庆工商大学通报学生称被恶意阻拦毕业#【一学生在网上反映其受到恶意阻拦毕业、学术霸凌问题，重庆工商大学通报：情况不属实】11月2日，@重庆工商大学 发布情况通报↓ #重庆一大学通报学生称被恶意阻拦毕业# （环球网）,2024-11-02 22:40,微博网页版
大学,广东,5096393272990586,想做快乐的懒羊羊,昨天说了两句国债估计平板听到我说话了今天就在b站推我了国债视频，点进去看了嚯好家伙那个人说的经济名词我都听过！！！哈哈哈哈哈就是不懂！！！！！全白学！！！我又一想我大学四年究竟学了什么啊……我现在有时候和别人说我学金融的都觉得嘎嘎讽刺昨天为什么提到了国债呢？！因为想买的人觉得我是学金融的我会懂，可是我是疫情时期的学生啊哈哈哈哈哈哈哈我能懂个p啊就是不是因为网课我又是什么东西啊，我会懂个p啊说实话当时我是多想我也能侃侃而谈，吧吧几句国债吧啦吧啦的利率吧啦吧啦的，怎么购买合适吧啦吧啦的，好好装一下，但是实际一句也没吧啦出来,2024-11-02 22:38,会暴富iPhone 14 Pro Max(银色)
大学,广东,5096393209812330,多少襟情,#向全世界安利茅子俊# 浙江财经大学生日快乐,2024-11-02 22:38,飞鸽传俊书Android
大学,广东,5096393189104313,匡匡菜菜105107,为什么我到了大学才学会懂礼貌……是不是有人觉得我太好惹了……,2024-11-02 22:38,荣耀X40
大学,广东,5096393188840761,霸占影视全,脚下是广阔的大海，来到海大，欢迎报考 #长相思相柳# #檀健次# #中国海洋大学用相柳招生# #上热门# #长相思大荒招生简章# #檀健次# L霸占影视全的微博视频,2024-11-02 22:38,微博视频号
大学,广东,5096393188573938,被迫改名的欧包,为什么看到沈湘宜和别人双排，他的情绪会有些低落？沈湘宜是土生土长的上海白富美，还是名牌大学的学生，追求她的人只多不少。她会愿意当他的男朋友吗？邬榕觉得好奇怪，明明主动私联他的是沈湘宜，但患得患失的人却是他自己。游戏里的队友又在因为选英雄吵了起来，全是韩文，邬榕一句都看不懂。他拿起手机，又继续给沈湘宜发微信：湘宝，开赛前还有两天休假，我请你吃洋房吧。————————————————————————————————————————————————————我也想成为竞男榜富婆操女粉，呜呜呜呜。,2024-11-02 22:38,Redmi K70
大学,广东,5096393183597738,番茄糊芋丝_huang,#2024挑战21天# @山东理工大学青年志愿者协会 个人赛道c95读书打卡,2024-11-02 22:38,iPhone客户端
大学,广东,5096393169699582,海獭酪糯糯,哈佛大学一项研究表明：“一个人的精神层次越高，心理越是健康，内心也越善良，不会因为别人的看法而轻易改变自己的本性。在对待别人时，他们微笑、喜悦的表情会越多，他们的人生也会活得更快乐。当一个人能足以包容所有生活的不愉快，能专注于自身的责任而不是利益时，那么也是最善良的人。”我们常说，爱笑的人运气不会太差也就是这个道理。我们总是说以貌取人。其实不一定说交朋友只喜欢漂亮的或者帅气的，而是这个人给人整体的感觉是健康的温暖的亲切的。而往往这样的人，人际关系也越好，各方面也就如鱼得水。而滋养一个人的好面相，最好的保养品，就是好心情，好心态，好性格。命由己造，相由心生。境随心转，福自我求。愿每一个人都可以通过修心，修出端庄、祥瑞之相，收获幸福人生。和我ss120ss读书吧,2024-11-02 22:38,几滴云
大学,广东,5096393171271816,拜托你薯别带上我ne,其实对于我们这种穷孩子来说 好好学习 考个好大学真的是最低成本的路了,2024-11-02 22:38,真我V23
大学,广东,5096393157116666,三辰公子,今年的愿望：希望扬州大学附属医院的chenminhua把贪污克扣工作人员的钱都用来买药，祝福她一辈子升不上职称，budehaosi🙏🙏🙏老天开眼吧，把她收了吧2安提瓜和巴布达,2024-11-02 22:37,荣耀V40轻奢版
大学,广东,5096393152661734,猫了个咪22,幼儿园没毕业不要来上大学，冲厕所是什么很难的事情学不会吗？没手还是没脚？,2024-11-02 22:37,HUAWEI P30
大学,广东,5096393146371891,IN话题指南,【#重庆工商大学通报学生称被学术霸凌#：情况不属实】#高校通报女生举报被学术霸凌# 新京报讯 11月2日，@重庆工商大学 微博发布情况通报，全文如下：,2024-11-02 22:37,微博发布平台专业版
大学,广东,5096393144535908,新浪看点,【#重庆工商大学通报学生称被学术霸凌#：情况不属实】#高校通报女生举报被学术霸凌# 新京报讯 11月2日，@重庆工商大学 微博发布情况通报，全文如下：,2024-11-02 22:37,微博发布平台专业版
大学,广东,5096393147156330,小浪同学敲黑板,【#重庆工商大学通报学生称被学术霸凌#：情况不属实】#高校通报女生举报被学术霸凌# 新京报讯 11月2日，@重庆工商大学 微博发布情况通报，全文如下：,2024-11-02 22:37,微博发布平台专业版
大学,广东,5096393137460314,手机上的新浪,【#重庆工商大学通报学生称被学术霸凌#：情况不属实】#高校通报女生举报被学术霸凌# 新京报讯 11月2日，@重庆工商大学 微博发布情况通报，全文如下：,2024-11-02 22:37,微博发布平台专业版
