keyword,region,id,user,text,created_at,source
大学,广东,5096395134470642,还是那个丞,#范丞丞演技#目前为止看到什么上大学没有不舍得，请问你们上过大学吗？刚刚经历辛苦的十年寒窗，去大学向往的生活，不是开心吗？哪个孩子哭唧唧？我们当年去上大学的时候都很开心，别没有生活经历就尬黑，真是够了，没必要！,2024-11-02 22:45,OPPO Find X7 Ultra
大学,广东,5096395132372200,gatsby2008,//@美国创业者:斯坦福大学公开课《跑步损伤：预防与治疗》,2024-11-02 22:45,iPhone客户端
大学,广东,5096395110090191,小猪拌饭_,好幸福好像回到大学了好青春如果可以真的想一直在大学校园里,2024-11-02 22:45,iPhone 14
大学,广东,5096395103275977,常州发型新媒体,原创：这些物件同城的你见过几个 在线调查投票O原创：这些物件同城的你见过几个 在线调查投票     原创：两天一洗头还是油光满面 厚长发+熬夜党定期清洁才是王道O原创：两天一洗头还是油光满面 厚长发+熬夜党定期清洁才是王道     告别油腻扁塌 哪种洗发水让你的秀发轻盈飘逸每一天O告别油腻扁塌 哪种洗发水让你的秀发轻盈飘逸每一天   原创：高端连锁美发店低价诱惑背后的“隐形布局” 外行人防坑指南O原创：高端连锁美发店低价诱惑背后的“隐形布局” 外行人防坑指南     秋季时尚经典减压发型 弧度直头发易打理新发型新风格新感觉O秋季时尚经典减压发型 弧度直头发易打理新发型新风格新感觉     专业美发店VS综合美容美发店：手艺人与生意人较量，你站哪边？O专业美发店VS综合美容美发店：手艺人与生意人较量，你站哪边？    #专业美发师必备# 如何挑选顶级专业剪刀 掌柜包邮 消费者下单掌柜提供专业技术指导O#专业美发师必备# 如何挑选顶级专业剪刀 掌柜包邮 消费者下单掌柜提供专业技术指导      #洗头大学问#：揭秘头发出油真相 资深小编为你定制专属护发秘籍O#洗头大学问#：揭秘头发出油真相 资深小编为你定制专属护发秘籍常州超话#社会民生##,2024-11-02 22:45,微博网页版
大学,广东,5096395100652219,對不起我太愛你們了,这么聪明！宝可以从取撸大学毕业了,2024-11-02 22:45,HarmonyOS设备
大学,广东,5096395075223770,财经记者圈,【耶鲁大学课程《金融市场》EP08-EP14】第 8 课 人性弱点，欺诈，操纵与管制 第 9 课 大卫•斯文森的客座演讲 第 10 课 债券市场：期限结构 第 11 课 股票 第 12 课 房地产金融和易受危机影响的脆弱性 第 13 课 银行业：成功和失败第 14 课 安德鲁•雷德利夫的客座演讲#金融##股市##股票# via L全球视频精选Premium的微博视频,2024-11-02 22:45,微博视频号
大学,广东,5096395068147316,xinn_YJ,能顺利活到这学期的第十五周吗 这哪是我大学第二年啊 这是我高中第五年…..不对我高中过的比现在好多了,2024-11-02 22:45,iPhone 14 Pro Max
大学,广东,5096394966699262,福西西的香菜鱼,//@范丞丞工作室:#庄图南因色弱险上大学#打破理想与现实的壁垒，年轻的庄图南@范丞丞Adam0616 在学习认识这个世界。一起待庄图南的成长和变化。#范丞丞庄图南# #范丞丞小巷人家#,2024-11-02 22:45,iPhone客户端
大学,广东,5096394966173276,明年必会上岸,#每日学习打卡# 第104天山东专升本交流超话#专升本上岸#“我不再装模作样地拥有许多伴侣，而是回到了孤独之中，以真正的我开头了独自的生活。”@师大教育官方微博 @师大宝要上岸 @临沂大学,2024-11-02 22:45,iPhone客户端
大学,广东,5096394929734552,大连理工大学,大连理工大学超话#After22:45##微博青年影像计划# 晚安💤大工  晚安💤DUTers卸下一天的疲惫，睡个好觉，迎接崭新的明天吧～留下你的晚安曲吧～,2024-11-02 22:45,大连理工大学超话
大学,广东,5096394927112828,郑州大学青年集结号,郑州大学超话#晚安郑大#生命自己总能找到蓬勃之路。,2024-11-02 22:45,郑州大学超话
大学,广东,5096394916368793,一朵云骑尉,突然想到，我们近70年来宣传“妇女能顶半边天”，但女性往往必须是在一点都不曾减少的家庭劳动之外，再额外承担一部分的社会劳动，去顶那多出来的“半边天”。当然不是说女性没有承担社会劳动的义务，而是男性，在女性顶了他们的半边天之后，也应该同等、同步地承担一部分家庭劳动的义务，然而他们却没有做到。想让女性真正获得自由发展，必然需要帮她从家庭劳动解脱出来，这样她才能和男性处在同样的社会竞争的起跑线上。于是对女性来说只有三条路：不婚不育、男女共同承担家庭劳动、本该由男性承担的家庭劳动部分由社会化服务代替。途径三需要一定的经济基础，途径一不现实，最简单合理低成本的途径二，目前看来，其实整个世界都没有做得特别好的地方。就好像对明清闺秀们的要求，以前只要三从四德就够了，现在是还要懂诗词歌赋做男人的解语花，要懂理家书算、要懂教育孩子（按高彦颐的说法这是三从四德plus版），这样才是好女人。而男人呢，只需要等老婆死了的时候美美写诗悼亡一下，或者帮老婆刻一下诗集，就是尊重女性的绝世好男人了呢,2024-11-02 22:44,微博 HTML5 版
大学,广东,5096394915845442,源源Salute,啊啊啊啊啊早早收拾洗完澡，奢侈的点了一堆烧烤，看全华班十一年来再次进入全球总决赛。忽然想起了大学，一大堆人围在一个电脑前面一起加油助威狂喊的日子,2024-11-02 22:44,iPhone客户端
大学,广东,5096394910080278,资本界杂志社,#魔咒韩漫##周一的救星# 29话（第一季完结）   两人如胶似漆甜甜蜜蜜，并决定一起努力考大学，耀日准备咨询美圆信息的路上，却遇见了曾经欺负过他的红毛！！！第一季终,2024-11-02 22:44,二次元条漫推荐官超话
大学,广东,5096394910076986,馬肉刺身酒場,"福原遥超话#福原遥# 有幸来到大东文化大学和亚细亚大学的文化祭 🙂 大家都很热情欢迎我,热烈的气氛给了我很大的力量！非常感谢每一个出场的人,感谢执委们所有的筹备和支持! 真的非常感谢！这是最快乐的时光❤️明天,我将参观大和大学的和纏祭! 我亲爱的大阪!好期待～🐙",2024-11-02 22:44,福原遥超话
大学,广东,5096394903260579,烤肉小精灵0324,山东财经大学超话 想问问在舜耕的同学们，你们考教资面试都是怎么去的啊，有没有那种直达的客车啥的,2024-11-02 22:44,山东财经大学超话
大学,广东,5096394865510902,土豆焖鸡1,#Faker说第五冠送给粉丝#我读高中的时候他在打，我现在都大学毕业了他还在打,2024-11-02 22:44,Redmi K70
大学,广东,5096394809676732,SVIP过期前最后一次改名,谁把我大学四年还我、我感觉现在不上班的每一天都在弥补以前没体验的好日子，但现在弥补又会落后别人，找工作也不好找。,2024-11-02 22:44,你阿公的iPhone 15 Pro
大学,广东,5096395110090191,小猪拌饭_,好幸福好像回到大学了好青春如果可以真的想一直在大学校园里,2024-11-02 22:45,iPhone 14
大学,广东,5096395103275977,常州发型新媒体,原创：这些物件同城的你见过几个 在线调查投票O原创：这些物件同城的你见过几个 在线调查投票     原创：两天一洗头还是油光满面 厚长发+熬夜党定期清洁才是王道O原创：两天一洗头还是油光满面 厚长发+熬夜党定期清洁才是王道     告别油腻扁塌 哪种洗发水让你的秀发轻盈飘逸每一天O告别油腻扁塌 哪种洗发水让你的秀发轻盈飘逸每一天   原创：高端连锁美发店低价诱惑背后的“隐形布局” 外行人防坑指南O原创：高端连锁美发店低价诱惑背后的“隐形布局” 外行人防坑指南     秋季时尚经典减压发型 弧度直头发易打理新发型新风格新感觉O秋季时尚经典减压发型 弧度直头发易打理新发型新风格新感觉     专业美发店VS综合美容美发店：手艺人与生意人较量，你站哪边？O专业美发店VS综合美容美发店：手艺人与生意人较量，你站哪边？    #专业美发师必备# 如何挑选顶级专业剪刀 掌柜包邮 消费者下单掌柜提供专业技术指导O#专业美发师必备# 如何挑选顶级专业剪刀 掌柜包邮 消费者下单掌柜提供专业技术指导      #洗头大学问#：揭秘头发出油真相 资深小编为你定制专属护发秘籍O#洗头大学问#：揭秘头发出油真相 资深小编为你定制专属护发秘籍常州超话#社会民生##,2024-11-02 22:45,微博网页版
大学,广东,5096395100652219,對不起我太愛你們了,这么聪明！宝可以从取撸大学毕业了,2024-11-02 22:45,HarmonyOS设备
大学,广东,5096395080733375,人類不宜飛行-l,翻到了一张大学的照片突然觉得自己有点不知好歹,2024-11-02 22:45,微博轻享版
大学,广东,5096395075223770,财经记者圈,【耶鲁大学课程《金融市场》EP08-EP14】第 8 课 人性弱点，欺诈，操纵与管制 第 9 课 大卫•斯文森的客座演讲 第 10 课 债券市场：期限结构 第 11 课 股票 第 12 课 房地产金融和易受危机影响的脆弱性 第 13 课 银行业：成功和失败第 14 课 安德鲁•雷德利夫的客座演讲#金融##股市##股票# via L全球视频精选Premium的微博视频,2024-11-02 22:45,微博视频号
大学,广东,5096395068147316,xinn_YJ,能顺利活到这学期的第十五周吗 这哪是我大学第二年啊 这是我高中第五年…..不对我高中过的比现在好多了,2024-11-02 22:45,iPhone 14 Pro Max
大学,广东,5096395037737915,大连理工大学微博协会,大连理工大学超话#After22:45# #微博青年影像计划# 晚安💤大工晚安💤DUTers卸下一天的疲惫，睡个好觉，迎接崭新的明天吧～留下你的晚安曲吧～,2024-11-02 22:45,iPhone 15 Plus
大学,广东,5096394966699262,福西西的香菜鱼,//@范丞丞工作室:#庄图南因色弱险上大学#打破理想与现实的壁垒，年轻的庄图南@范丞丞Adam0616 在学习认识这个世界。一起待庄图南的成长和变化。#范丞丞庄图南# #范丞丞小巷人家#,2024-11-02 22:45,iPhone客户端
大学,广东,5096394966173276,明年必会上岸,#每日学习打卡# 第104天山东专升本交流超话#专升本上岸#“我不再装模作样地拥有许多伴侣，而是回到了孤独之中，以真正的我开头了独自的生活。”@师大教育官方微博 @师大宝要上岸 @临沂大学,2024-11-02 22:45,iPhone客户端
大学,广东,5096394929734552,大连理工大学,大连理工大学超话#After22:45##微博青年影像计划# 晚安💤大工  晚安💤DUTers卸下一天的疲惫，睡个好觉，迎接崭新的明天吧～留下你的晚安曲吧～,2024-11-02 22:45,大连理工大学超话
大学,广东,5096394927112828,郑州大学青年集结号,郑州大学超话#晚安郑大#生命自己总能找到蓬勃之路。,2024-11-02 22:45,郑州大学超话
大学,广东,5096394916368793,一朵云骑尉,突然想到，我们近70年来宣传“妇女能顶半边天”，但女性往往必须是在一点都不曾减少的家庭劳动之外，再额外承担一部分的社会劳动，去顶那多出来的“半边天”。当然不是说女性没有承担社会劳动的义务，而是男性，在女性顶了他们的半边天之后，也应该同等、同步地承担一部分家庭劳动的义务，然而他们却没有做到。想让女性真正获得自由发展，必然需要帮她从家庭劳动解脱出来，这样她才能和男性处在同样的社会竞争的起跑线上。于是对女性来说只有三条路：不婚不育、男女共同承担家庭劳动、本该由男性承担的家庭劳动部分由社会化服务代替。途径三需要一定的经济基础，途径一不现实，最简单合理低成本的途径二，目前看来，其实整个世界都没有做得特别好的地方。就好像对明清闺秀们的要求，以前只要三从四德就够了，现在是还要懂诗词歌赋做男人的解语花，要懂理家书算、要懂教育孩子（按高彦颐的说法这是三从四德plus版），这样才是好女人。而男人呢，只需要等老婆死了的时候美美写诗悼亡一下，或者帮老婆刻一下诗集，就是尊重女性的绝世好男人了呢,2024-11-02 22:44,微博 HTML5 版
大学,广东,5096394915845442,源源Salute,啊啊啊啊啊早早收拾洗完澡，奢侈的点了一堆烧烤，看全华班十一年来再次进入全球总决赛。忽然想起了大学，一大堆人围在一个电脑前面一起加油助威狂喊的日子,2024-11-02 22:44,iPhone客户端
大学,广东,5096394910080278,资本界杂志社,#魔咒韩漫##周一的救星# 29话（第一季完结）   两人如胶似漆甜甜蜜蜜，并决定一起努力考大学，耀日准备咨询美圆信息的路上，却遇见了曾经欺负过他的红毛！！！第一季终,2024-11-02 22:44,二次元条漫推荐官超话
大学,广东,5096394910076986,馬肉刺身酒場,"福原遥超话#福原遥# 有幸来到大东文化大学和亚细亚大学的文化祭 🙂 大家都很热情欢迎我,热烈的气氛给了我很大的力量！非常感谢每一个出场的人,感谢执委们所有的筹备和支持! 真的非常感谢！这是最快乐的时光❤️明天,我将参观大和大学的和纏祭! 我亲爱的大阪!好期待～🐙",2024-11-02 22:44,福原遥超话
大学,广东,5096394903260579,烤肉小精灵0324,山东财经大学超话 想问问在舜耕的同学们，你们考教资面试都是怎么去的啊，有没有那种直达的客车啥的,2024-11-02 22:44,山东财经大学超话
大学,广东,5096394865510902,土豆焖鸡1,#Faker说第五冠送给粉丝#我读高中的时候他在打，我现在都大学毕业了他还在打,2024-11-02 22:44,Redmi K70
大学,广东,5096394810986421,我鱼鱼你,华北理工大学超话#仙家看事##广结善缘##玄学##算卦# L我鱼鱼你的微博视频,2024-11-02 22:44,华北理工大学超话
大学,广东,5096394430613958,老公在外面当gay,妈的太可怕了我的大学生活结束了拜拜，，拜拜太好了呜呜呜呜,2024-11-02 22:43,我是皇帝Android
大学,广东,5096394413312895,河南手机报,#2小伙买刮刮乐中百万室友发声#小小互动博，#大学期间你和室友一起旅游过么#~ #大学期间你和室友一起旅游过么#,2024-11-02 22:42,
大学,广东,5096394406763678,草莓味的芒果包,一个闪现到海南✈️参加大学舍友的婚礼💒祝亮亮幸福美满快乐,2024-11-02 22:42,iPhone客户端
大学,广东,5096394401257300,LuckyT222,#河北工业职业技术大学##河北工职大分享#,2024-11-02 22:42,iPhone客户端
大学,广东,5096394391556918,_橘井四时春,牳又在忆往昔了，巴不得别人忘记牛牛著名巴蜀一日游被聚宝最后被灰溜溜塞进国际高的事//@戏帝戏戏水:多自卑把高中得到的参与奖上了大学发朋友圈炫耀，忘记了，老牛好像没上过高中，也没上过大学,2024-11-02 22:42,华为手机
大学,广东,5096394381853061,颜十七-,很久没关注了…但是这波瞬间把我带回大学在宿舍熬夜打游戏的日子#2024lpl#,2024-11-02 22:42,iPhone客户端
大学,广东,5096394379499603,悦己熊,在庆祝泗水国立大学孔子学院成立的十三周年我在庆祝活动中听到了国歌《义勇军进行曲》我们一起笔直地站着大声地唱着心中感慨万千随之而来的是热泪盈眶这是我第一次在国外听到国歌眼泪溢出的时候我又一次发现我是如此如此地思念我的祖国！,2024-11-02 22:42,iPhone
大学,广东,5096394356691064,刘玉磊D围脖,今天去吃晚饭隔壁桌拿了一张海报是最爱的火影剧场版 11.9日 我回来了！！仔细想了下 火影完结十周年了10年前的现在2014年的11月 高三的时候随着火影佐助在终末之谷战斗结束 火影完结 当时没有哭的很伤心  漫画虽然结束 觉得以火影水的速度 大学毕业都看不到火影动漫完结。后来到了2018年 清楚记得大三下学期 在宿舍看火影动漫的最后一集时 舍不得打开 结局是鸣人雏田婚礼 忍不住在宿舍哭了出来 小学追火影的情节全迸发出来 终于又能在影院看到火影了,2024-11-02 22:42,HUAWEI Mate 60 Pro
大学,广东,5096394327330784,心诚则零卡路里i,我的小学同学和我的大学同学是同事是什么感觉,2024-11-02 22:42,iPhone 14 Pro Max
大学,广东,5096394318681383,嘟嘟猫猫教主ovo,河北工程大学超话  有无女生800替考,2024-11-02 22:42,河北工程大学超话
大学,广东,5096394314483880,张老先生的后花园,这是我好多年前的饭搭子，我特意去找到这张图片，我甚至还记得每一段稿子开始前推设备的紧张感。那时候别人吃饭我广播，每天最开心的就是让全校听到我挑选的歌。从高中到大学，广播站承载了我的梦，它鼓舞了从小一直生活在传统思想、男权阴影下的我、从小在反感我抛头露面、开朗外向的环境下长大的我，让我成为我自己，让这样的一个女生有了最初的声音，才有了后面坚持参加一切演讲比赛、辩论赛、主持活动的我。最可怕的是，没有人真正了解你，如果连你自己都忘了自己最真实的样子，就是彻底被改变了。,2024-11-02 22:42,iPhone客户端
大学,广东,5096394312913371,保定校园,#河北校园的韩剧氛围##当中式留白走进河北校园# 一如既往，夜晚、校园、操场。你总是喜欢去操场走走，抬头看望星星月亮，世界安静、听听自己内心的声音。#晚安大保定# ｜@河北经贸大学经济管理学院微博,2024-11-02 22:42,保定校园超话
大学,广东,5096394306360752,山东理工大学经济学院于佳怡,2024挑战21天超话#2024挑战21天# @山东理工大学青年志愿者协会 个人赛B42坚持锻炼打卡，做最好的自己。加油！加油！加油！,2024-11-02 22:42,OPPO Reno12
大学,广东,5096394268612930,梦女无响应,考上大学改名叫门耀祖@门里爬出来的女鬼 @海色千鳥,2024-11-02 22:42,iPhone客户端
大学,广东,5096394262839402,北京美弗留学高端留学,"【约翰霍普金斯大学录取来了,连线中...】当别的学生还没找到留学机构,还在准备材料的时间,我们的学生已经拿到约翰霍普金斯大学的录取了,只有提早规划才能快人一步,接下来听一下美弗留学洛老师和学生的对话. L北京美弗留学高端留学的微博视频",2024-11-02 22:42,微博视频号
大学,广东,5096394257600513,叹吾生之多艰,【黑泥】其实有时候很季度好朋友，高柱很小的时候麻麻就去世了，亲爹不怎么管我，是我奶奶把我养大的，遇到她才知道原来正常家庭是这样的，她从小在父母的爱里长大，高考没考好但父母依然给她买了最新款的手机，现在上了大学经常跟我分享她跟蛇油又去哪里玩了吃了什么好吃的，跟我说她家里人一个月给她3k生活费，每次看到她幸福的跟我分享日常我就会想，我要是也有妈妈是不是也会过得很幸福呢？有妈妈真好呀。,2024-11-02 22:42,
大学,广东,5096394499037962,糖糖糖甜豆,很难相信大学时最时髦最个性的舍友现在变成喜欢在朋友圈发儿子🐔🐔照的妈妈,2024-11-02 22:43,iPhone客户端
大学,广东,5096394495100591,我的上上签K,#萧逸的万圣邀请函# 萧逸后续卡面用心准备🥰核心诉⃑求仍是【睁眼正脸&微侧⃐脸】【卡面动作创新精致度高】【保证约会时长及文案质量】谨记萧逸是你游唯一神族男主，卡面多体现神族元素，期待火神&大海设定展开想看萧逸五冠王夺冠喷香槟颁奖典礼；男模圣体、乐队吉他手、大学校园等卡面🥺@光与夜之恋,2024-11-02 22:43,光与夜之恋萧逸超话
大学,广东,5096394457088572,一周睡八天困困,如图这是一个菜市场离我们大学很近的一个市场同时也会有附近的居民下班的时候去附近买菜！那里有很多爷爷奶奶在哪里买菜！但我每次去到那里我都会想起张钥沅的那句:普通农户家的蔬菜根本进不了商超！！我越来越能体会这句话！,2024-11-02 22:43,vivo Y78
大学,广东,5096394430613958,老公在外面当gay,妈的太可怕了我的大学生活结束了拜拜，，拜拜太好了呜呜呜呜,2024-11-02 22:43,我是皇帝Android
大学,广东,5096394413312895,河南手机报,#2小伙买刮刮乐中百万室友发声#小小互动博，#大学期间你和室友一起旅游过么#~ #大学期间你和室友一起旅游过么#,2024-11-02 22:42,
大学,广东,5096394406763678,草莓味的芒果包,一个闪现到海南✈️参加大学舍友的婚礼💒祝亮亮幸福美满快乐,2024-11-02 22:42,iPhone客户端
大学,广东,5096394401257300,LuckyT222,#河北工业职业技术大学##河北工职大分享#,2024-11-02 22:42,iPhone客户端
大学,广东,5096394391556918,_橘井四时春,牳又在忆往昔了，巴不得别人忘记牛牛著名巴蜀一日游被聚宝最后被灰溜溜塞进国际高的事//@戏帝戏戏水:多自卑把高中得到的参与奖上了大学发朋友圈炫耀，忘记了，老牛好像没上过高中，也没上过大学,2024-11-02 22:42,华为手机
大学,广东,5096394100835281,-今天也没睡醒啊,看到pyq的学妹上大学感觉好幸福啊,2024-11-02 22:41,iPhone 14 Pro
大学,广东,5096394074097721,宁馨儿今天退休了嘛,我喆声音和大学老师的角色也好适配高贵却不失温柔    听的人心里美美滴,2024-11-02 22:41,iPhone客户端
大学,广东,5096394058631501,倾水揽星河,在这度过一年多的早7晚10是大学时最充实的时光怀念啊我的青春啊,2024-11-02 22:41,HUAWEI P60 Pro
大学,广东,5096394044479880,栗栗mm1,今天有件喜事 成功预约国博这是我第三次去北京了 上一次还是大学很开心,2024-11-02 22:41,iPhone客户端
大学,广东,5096394044735786,心动宁波,【学习身边的榜样——余姚市二职校教师 郑晓红 #坚守初心德技双馨# 】郑晓红老师出生于四明山的一个小山村中村，那里山清水秀，民风淳朴。她自小便对大自然充满了热爱，对农业有着浓厚的兴趣。大学毕业后，她毅然放弃了城市里的工作机会，选择回到老区，投身于农业教育事业。她深知，农业是国家的根本，而教育则是推动农业发展的不竭动力。因此，她立志通过自己的努力，为家乡的农业发展培养更多的人才。教育是一项神圣的事业，需要用心去经营、用爱去浇灌。21年来，郑晓红老师始终坚守在教育的第一线，她不仅负责国家级赛事的相关工作，还担任了15年的班主任，用自己的实际行动去感染和影响学生，让他们在成长的道路上少走弯路，过上有尊严的生活，收获更出彩的人生。 2宁波,2024-11-02 22:41,
大学,广东,5096394035043407,从前有一只废话,每一次线下和同担老公们见面的时候都会想起大学毕业那几个月的疯狂线下时刻🥺人怎么可以这么幸福,2024-11-02 22:41,
大学,广东,5096394031896052,她惊艳我,苏州大学研究生超话,2024-11-02 22:41,苏州大学研究生超话
大学,广东,5096394027172571,megu蘑菇,八分钟速扎明天背去上早八报了辅修是我大学四年最失败的决定g77脑袋好硬使我的垃圾痛板摇摇欲坠,2024-11-02 22:41,HUAWEI P40 5G
大学,广东,5096394018263662,荒烟蔓草的从前,#终身学习有多重要#  @高顿 终身学习的重要性不言而喻，在我身边，姑姑就是一个终身学习的杰出榜样。姑姑自幼对语文情有独钟，上学时就凭借出色的文笔频繁投稿并登上优秀作文榜。大学选择了汉语言文学专业，毕业后顺利考进教师编制，从事语文教学工作。然而，她并未就此满足，即便成为了老师，依然在学习的道路上不断前行。除了深耕语文知识，还钻研历史知识，在家中时常为我们讲述精彩的历史故事。如今，姑姑已年届五十，但学习的热情从未减退。只要有时间，她就会沉浸在书的世界里，从不懈怠。她常说，看书是一种享受，将知识传授给他人更是一种幸福。姑姑用自己的行动诠释了终身学习的意义。她不仅不断充实和提升自己，更通过持续学习保持着对生活的热爱和对知识的敬畏。在她身上，我看到了终身学习带来的丰富内涵和无尽价值，它让人始终保持敏锐的思维，不断拓展视野，适应时代的变化，也让人的精神世界愈发充实和满足。我会一直以姑姑为榜样，拥抱终身学习，追求更有意义和价值的人生。,2024-11-02 22:41,iPhone 15
大学,广东,5096394006988043,她惊艳我,苏州大学考研超话,2024-11-02 22:41,苏州大学考研超话
